roll,name,age,year,sec,dp,eng,math,sci,isl,ar,avg,comment,,
123456,Safee Muhaha,36,10,B,56,67,89,98,76,67,79.4,"He has been able to confidently discuss occasions when it is correct to show compassion and tolerance and understands the 
concept of honesty and care towards others . He is an amazing boy with good brain",,
123456,Rafay Muhaha,45,10,A,78,67,89,73,45,67,68.2,He is an amazing boy with good brain,,
1234,Bob Muhaha,65,9,A,56,56,34,76,23,76,53,,,
32423423,Azeem,34,8,A,45,56,76,67,45,34,55.6,,,
